{
  "id": "egypt-sojourn",
  "title": {
    "ru": "Израиль в Египте",
    "short": "В Египте"
  },
  "start": -1876,
  "end": -1446,
  "approx": true,
  "engineEra": "bronze",
  "colorToken": "#e8c879",
  "colorStatus": "contract",
  "maps": [],
  "keyEvents": [
    "Иосиф — второй в Египте",
    "430 лет пребывания (Исх 12:40)",
    "Моисей"
  ],
  "note": "Иосифская часть будущей карты «Иаков и Иосиф» (KA-9). Датировка по консервативной библейской хронологии"
}